<?xml version="1.0" encoding="UTF-8"?>
<list xmlns:xsi="http://www.w3.org/2001/XMLSchema-instance" xsi:noNamespaceSchemaLocation="xsd/L2HubPhantoms.xsd">
	<!-- L2Hub: напарники-фантомы. Сгенерировано tools/fake_players.py, правки — в таблице COMPANIONS. -->
	<!-- Vesna: хилер, Human Mystic, Cleric, Bishop, Cardinal -->
	<phantom name="Vesna" role="HEALER" female="true" face="0" hairStyle="3" hairColor="0" classes="10,15,16,97" aliases="весна;веснушка;vesnushka" x="83208" y="148132" z="-3408">
		<gear grade="NONE" minLevel="1" rhand="7" shots="3947" /> <!-- Apprentice's Rod -->
		<gear grade="D" minLevel="20" rhand="180" chest="436" legs="469" gloves="2447" shots="3948" /> <!-- Mace of Judgment, Tunic of Knowledge, Stockings of Knowledge, Gloves of Knowledge -->
		<gear grade="C" minLevel="40" rhand="174" chest="441" legs="472" gloves="2459" shots="3949" /> <!-- Nirvana Axe, Demon's Tunic, Demon's Stockings, Demon's Gloves -->
		<gear grade="B" minLevel="52" rhand="10899" head="503" chest="2397" legs="2402" gloves="5712" feet="5728" shots="3950" /> <!-- Spell Breaker - Hail - Acumen, Zubei's Helmet, Tunic of Zubei, Stockings of Zubei, Zubei's Gauntlets - Robe, Zubei's Boots - Robe -->
		<gear grade="A" minLevel="61" rhand="7895" head="547" chest="2400" legs="2405" gloves="5770" feet="5782" shots="3951" /> <!-- Flaming Dragon Skull, Tallum Helm, Tallum Tunic, Tallum Stockings, Tallum Gloves - Robe, Tallum Boots - Robe -->
		<gear grade="S" minLevel="76" rhand="11223" head="6386" chest="6383" gloves="6384" feet="6385" shots="3952" /> <!-- Arcana Mace - Nature - Acumen, Major Arcana Circlet, Major Arcana Robe, Major Arcana Gloves, Major Arcana Boots -->
		<gear grade="S80" minLevel="80" rhand="10455" head="9438" chest="10238" legs="9437" gloves="9439" feet="9440" shots="3952" /> <!-- Icarus Hall - Mana Up, Dynasty Circlet, Dynasty Silver Satin Tunic - Summoner, Dynasty Stockings, Dynasty Gloves - Robe, Dynasty Shoes - Robe -->
		<gear grade="S84" minLevel="84" rhand="15892" head="13139" chest="13434" legs="13444" gloves="13445" feet="13446" shots="3952" /> <!-- Sacredium - Mana Up, Vesper Circlet, Vesper Tunic, Vesper Stockings, Vesper Gloves, Vesper Shoes -->
	</phantom>
	<!-- Mityai: баффер, Human Mystic, Cleric, Prophet, Hierophant -->
	<phantom name="Mityai" role="BUFFER" female="false" face="0" hairStyle="3" hairColor="0" classes="10,15,17,98" aliases="митяй;митя;мить;mityay;mitya;mitia" x="83374" y="148422" z="-3400">
		<gear grade="NONE" minLevel="1" rhand="7816" shots="3947" /> <!-- Apprentice Adventurer's Staff -->
		<gear grade="D" minLevel="20" rhand="7825" chest="436" legs="469" gloves="2447" shots="3948" /> <!-- Traveler's Staff, Tunic of Knowledge, Stockings of Knowledge, Gloves of Knowledge -->
		<gear grade="C" minLevel="40" rhand="195" chest="441" legs="472" gloves="2459" shots="3949" /> <!-- Cursed Staff, Demon's Tunic, Demon's Stockings, Demon's Gloves -->
		<gear grade="B" minLevel="52" rhand="209" head="2416" chest="2398" legs="2403" gloves="5720" feet="5736" shots="3950" /> <!-- Divine Staff, Blue Wolf Helmet, Blue Wolf Tunic, Blue Wolf Stockings, Blue Wolf Gloves - Robe, Blue Wolf Boots - Robe -->
		<gear grade="A" minLevel="61" rhand="11106" head="2418" chest="2408" gloves="5773" feet="5785" shots="3951" /> <!-- Branch of the Mother Tree - Nature - Magic Damage, Helm of Nightmare, Robe of Nightmare, Gauntlets of Nightmare - Robe, Boots of Nightmare - Robe -->
		<gear grade="S" minLevel="76" rhand="10529" head="6386" chest="6383" gloves="6384" feet="6385" shots="3952" /> <!-- Dynasty Staff - Acumen, Major Arcana Circlet, Major Arcana Robe, Major Arcana Gloves, Major Arcana Boots -->
		<gear grade="S80" minLevel="80" rhand="11348" head="9438" chest="10238" legs="9437" gloves="9439" feet="9440" shots="3952" /> <!-- Icarus Hall - Hail - Acumen, Dynasty Circlet, Dynasty Silver Satin Tunic - Summoner, Dynasty Stockings, Dynasty Gloves - Robe, Dynasty Shoes - Robe -->
		<gear grade="S84" minLevel="84" rhand="15854" head="13139" chest="13434" legs="13444" gloves="13445" feet="13446" shots="3952" /> <!-- Black Visage - Magic Hold, Vesper Circlet, Vesper Tunic, Vesper Stockings, Vesper Gloves, Vesper Shoes -->
	</phantom>
	<!-- Kuzya: охотник, Dwarf Fighter, Artisan, Warsmith, Maestro -->
	<phantom name="Kuzya" kind="hunter" role="DAMAGE" female="false" face="0" hairStyle="0" hairColor="3" classes="53,56,57,118" aliases="кузя;кузьма" social="1.5" temper="0.5" x="115502" y="-177693" z="-904">
		<gear grade="NONE" minLevel="1" rhand="2370" chest="1146" legs="1147" shots="1835" /> <!-- Guild Member's Club, Squire's Shirt, Squire's Pants -->
		<gear grade="D" minLevel="20" rhand="168" head="2411" chest="352" legs="2378" shots="1463" /> <!-- Work Hammer, Brigandine Helmet, Brigandine Tunic, Brigandine Gaiters -->
		<gear grade="C" minLevel="40" rhand="161" head="2413" chest="354" legs="381" shots="1464" /> <!-- Silver Axe, Chain Hood, Chain Mail Shirt, Chain Gaiters -->
		<gear grade="B" minLevel="52" rhand="91" head="2415" chest="2376" legs="2379" gloves="5714" feet="5730" shots="1465" /> <!-- Heavy War Axe, Avadon Circlet, Avadon Breastplate, Avadon Gaiters, Avadon Gloves - Heavy Armor, Avadon Boots - Heavy Armor -->
		<gear grade="A" minLevel="61" rhand="8763" head="547" chest="2382" gloves="5768" feet="5780" shots="1466" /> <!-- Elrokian Trap, Tallum Helm, Tallum Plate Armor, Tallum Gloves - Heavy Armor, Tallum Boots - Heavy Armor -->
		<gear grade="S" minLevel="76" rhand="6365" head="6378" chest="6373" legs="6374" gloves="6375" feet="6376" shots="1467" /> <!-- Basalt Battlehammer, Imperial Crusader Helmet, Imperial Crusader Breastplate, Imperial Crusader Gaiters, Imperial Crusader Gauntlets, Imperial Crusader Boots -->
		<gear grade="S80" minLevel="80" rhand="10220" head="9422" chest="9417" legs="9421" gloves="9423" feet="9424" shots="1467" /> <!-- Icarus Hammer, Dynasty Helmet, Dynasty Breast Plate - Shield Master, Dynasty Gaiters, Dynasty Gauntlet - Heavy Armor, Dynasty Boots - Heavy Armor -->
		<gear grade="S84" minLevel="84" rhand="15678" head="13140" chest="13435" legs="13448" gloves="13449" feet="13450" shots="1467" /> <!-- Triumph Hammer, Vesper Noble Helmet, Vesper Noble Breastplate, Vesper Noble Gaiters, Vesper Noble Gauntlet, Vesper Noble Boots -->
	</phantom>
	<!-- LunaTik: охотник, Elven Mystic, Elven Wizard, Spellsinger, Mystic Muse -->
	<phantom name="LunaTik" kind="hunter" role="DAMAGE" female="true" face="0" hairStyle="3" hairColor="0" classes="25,26,27,103" aliases="луна;лунатик" social="1" temper="0.5" x="46846" y="51112" z="-2992">
		<gear grade="NONE" minLevel="1" rhand="6" chest="425" legs="461" shots="3947" /> <!-- Apprentice's Wand, Apprentice's Tunic, Apprentice's Stockings -->
		<gear grade="D" minLevel="20" rhand="178" chest="436" legs="469" gloves="2447" shots="3948" /> <!-- Bone Staff, Tunic of Knowledge, Stockings of Knowledge, Gloves of Knowledge -->
		<gear grade="C" minLevel="40" rhand="192" chest="442" legs="473" gloves="2463" shots="3949" /> <!-- Crystal Staff, Divine Tunic, Divine Stockings, Divine Gloves -->
		<gear grade="B" minLevel="52" rhand="208" head="2416" chest="2398" legs="2403" gloves="5720" feet="5736" shots="3950" /> <!-- Staff of Seal, Blue Wolf Helmet, Blue Wolf Tunic, Blue Wolf Stockings, Blue Wolf Gloves - Robe, Blue Wolf Boots - Robe -->
		<gear grade="A" minLevel="61" rhand="4903" head="2418" chest="2408" gloves="5773" feet="5785" shots="3951" /> <!-- Dasparion's Staff, Helm of Nightmare, Robe of Nightmare, Gauntlets of Nightmare - Robe, Boots of Nightmare - Robe -->
		<gear grade="S" minLevel="76" rhand="6366" head="6386" chest="6383" gloves="6384" feet="6385" shots="3952" /> <!-- Imperial Staff, Major Arcana Circlet, Major Arcana Robe, Major Arcana Gloves, Major Arcana Boots -->
		<gear grade="S80" minLevel="80" rhand="10222" head="9438" chest="9435" legs="9437" gloves="9439" feet="9440" shots="3952" /> <!-- Icarus Hall, Dynasty Circlet, Dynasty Tunic - Summoner, Dynasty Stockings, Dynasty Gloves - Robe, Dynasty Shoes - Robe -->
		<gear grade="S84" minLevel="84" rhand="15566" head="13139" chest="13434" legs="13444" gloves="13445" feet="13446" shots="3952" /> <!-- Black Visage, Vesper Circlet, Vesper Tunic, Vesper Stockings, Vesper Gloves, Vesper Shoes -->
	</phantom>
	<!-- Vovan: охотник, Human Fighter, Human Knight, Paladin, Phoenix Knight -->
	<phantom name="Vovan" kind="hunter" role="TANK" female="false" face="1" hairStyle="2" hairColor="0" classes="0,4,5,90" aliases="вован;вова;вовчик" social="1" temper="1.2" x="-84567" y="244226" z="-3728">
		<gear grade="NONE" minLevel="1" rhand="2369" chest="1146" legs="1147" shots="1835" /> <!-- Squire's Sword, Squire's Shirt, Squire's Pants -->
		<gear grade="D" minLevel="20" rhand="123" head="2411" chest="352" legs="2378" lhand="2493" shots="1463" /> <!-- Saber, Brigandine Helmet, Brigandine Tunic, Brigandine Gaiters, Brigandine Shield -->
		<gear grade="C" minLevel="40" rhand="133" head="2414" chest="356" lhand="2497" shots="1464" /> <!-- Raid Sword, Full Plate Helmet, Full Plate Armor, Full Plate Shield -->
		<gear grade="B" minLevel="52" rhand="142" head="2415" chest="2376" legs="2379" gloves="5714" feet="5730" lhand="673" shots="1465" /> <!-- Keshanberk, Avadon Circlet, Avadon Breastplate, Avadon Gaiters, Avadon Gloves - Heavy Armor, Avadon Boots - Heavy Armor, Avadon Shield -->
		<gear grade="A" minLevel="61" rhand="80" head="547" chest="2382" gloves="5768" feet="5780" shots="1466" /> <!-- Tallum Blade, Tallum Helm, Tallum Plate Armor, Tallum Gloves - Heavy Armor, Tallum Boots - Heavy Armor -->
		<gear grade="S" minLevel="76" rhand="6364" head="6378" chest="6373" legs="6374" gloves="6375" feet="6376" lhand="6377" shots="1467" /> <!-- Forgotten Blade, Imperial Crusader Helmet, Imperial Crusader Breastplate, Imperial Crusader Gaiters, Imperial Crusader Gauntlets, Imperial Crusader Boots, Imperial Crusader Shield -->